{
  "$schema": "http://json-schema.org/draft-07/schema#",
  "title": "Chiara Plugin Manifest",
  "description": "Manifest di un plugin dichiarativo (no-code) per Chiara.",
  "type": "object",
  "required": ["schemaVersion", "id", "name", "version", "trigger", "actions"],
  "additionalProperties": false,
  "properties": {
    "schemaVersion": { "const": 1 },
    "id": {
      "type": "string",
      "pattern": "^[a-z0-9][a-z0-9._-]{0,63}$",
      "description": "Identificatore univoco (solo minuscole, numeri, . _ -)"
    },
    "name": { "type": "string", "minLength": 1 },
    "description": { "type": "string" },
    "version": { "type": "string", "minLength": 1 },
    "author": {
      "type": "object",
      "properties": {
        "name": { "type": "string" },
        "email": { "type": "string" },
        "url": { "type": "string" }
      }
    },
    "tier": { "enum": ["free", "ultra"], "description": "free = tutti gli utenti, ultra = solo piano ULTRA" },
    "trigger": {
      "type": "object",
      "oneOf": [
        {
          "required": ["type", "pattern"],
          "properties": {
            "type": { "const": "regex" },
            "pattern": { "type": "string" },
            "flags": { "type": "string" }
          }
        },
        {
          "required": ["type", "command"],
          "properties": {
            "type": { "const": "command" },
            "command": { "type": "string" }
          }
        },
        {
          "required": ["type", "intent"],
          "properties": {
            "type": { "const": "intent" },
            "intent": { "type": "string" }
          }
        }
      ]
    },
    "actions": {
      "type": "array",
      "minItems": 1,
      "items": { "$ref": "#/definitions/action" }
    }
  },
  "definitions": {
    "action": {
      "type": "object",
      "oneOf": [
        {
          "required": ["type", "template"],
          "properties": {
            "type": { "const": "reply" },
            "template": { "type": "string" }
          }
        },
        {
          "required": ["type", "options"],
          "properties": {
            "type": { "const": "random" },
            "options": { "type": "array", "items": { "type": "string" }, "minItems": 1 }
          }
        },
        {
          "required": ["type", "tool"],
          "properties": {
            "type": { "const": "tool" },
            "tool": { "type": "string" },
            "input": { "type": "string" },
            "template": { "type": "string" }
          }
        },
        {
          "required": ["type", "key"],
          "properties": {
            "type": { "const": "store" },
            "key": { "type": "string" },
            "value": { "type": "string" }
          }
        },
        {
          "required": ["type", "key"],
          "properties": {
            "type": { "const": "read" },
            "key": { "type": "string" },
            "template": { "type": "string" }
          }
        }
      ]
    }
  }
}
